{
  "schema_version": "1.0.0",
  "source_documents": [
    {
      "document_id": "doc-messy-email",
      "document_type": "email"
    },
    {
      "document_id": "doc-messy-scan",
      "document_type": "pdf"
    },
    {
      "document_id": "doc-messy-note",
      "document_type": "other"
    }
  ],
  "intake_metadata": {
    "channel": "email",
    "attachment_count": 2
  },
  "cedent_name": {
    "value": "Fictional Cedent Gamma Ltd",
    "confidence": 0.88,
    "evidence": [
      {
        "document_id": "doc-messy-email",
        "location": "opening line",
        "quote": "Fictional Cedent Gamma Ltd gives notice of a loss."
      }
    ],
    "reason": null
  },
  "treaty_references": [
    {
      "value": "GAMMA-TREATY-A",
      "confidence": 0.82,
      "evidence": [
        {
          "document_id": "doc-messy-scan",
          "location": "page 1, upper margin",
          "quote": "Contract GAMMA-TREATY-A."
        }
      ],
      "reason": null
    },
    {
      "value": "GAMMA-TREATY-B",
      "confidence": 0.76,
      "evidence": [
        {
          "document_id": "doc-messy-note",
          "location": "line 6",
          "quote": "Also see GAMMA-TREATY-B."
        }
      ],
      "reason": null
    }
  ],
  "date_of_loss": {
    "value": null,
    "confidence": 0,
    "evidence": [
      {
        "document_id": "doc-messy-scan",
        "location": "page 1, paragraph 3",
        "quote": "The loss occurred during the first weekend of October 2026."
      }
    ],
    "reason": "ambiguous"
  },
  "date_of_notification": {
    "value": "2026-10-06",
    "confidence": 0.91,
    "evidence": [
      {
        "document_id": "doc-messy-email",
        "location": "sent-date header",
        "quote": "Sent: 6 October 2026 16:40."
      }
    ],
    "reason": null
  },
  "loss_description": {
    "value": "Water entered the fictional storage room after a pipe failed.",
    "confidence": 0.84,
    "evidence": [
      {
        "document_id": "doc-messy-scan",
        "location": "page 1, paragraph 4",
        "quote": "Water entered the fictional storage room after a pipe failed."
      }
    ],
    "reason": null
  },
  "estimated_loss_amount": {
    "value": {
      "amount": "48000.5",
      "currency": "EUR"
    },
    "confidence": 0.71,
    "evidence": [
      {
        "document_id": "doc-messy-scan",
        "location": "page 2, paragraph 1",
        "quote": "Preliminary estimate: EUR 48,000.50."
      }
    ],
    "reason": null
  },
  "cedent_claim_reference": {
    "value": null,
    "confidence": 0,
    "evidence": [],
    "reason": "not_found"
  },
  "original_insured_name": {
    "value": "Fictional Insured Delta Ltd",
    "confidence": 0.8,
    "evidence": [
      {
        "document_id": "doc-messy-note",
        "location": "line 2",
        "quote": "Insured: Fictional Insured Delta Ltd."
      }
    ],
    "reason": null
  },
  "territory_or_country": {
    "value": "Fictional Territory E",
    "confidence": 0.77,
    "evidence": [
      {
        "document_id": "doc-messy-note",
        "location": "line 3",
        "quote": "Country: Fictional Territory E."
      }
    ],
    "reason": null
  },
  "peril_or_cause": {
    "value": "Escape of water",
    "confidence": 0.85,
    "evidence": [
      {
        "document_id": "doc-messy-scan",
        "location": "page 1, paragraph 4",
        "quote": "Cause: escape of water from a pipe."
      }
    ],
    "reason": null
  },
  "loss_location": {
    "value": null,
    "confidence": 0,
    "evidence": [
      {
        "document_id": "doc-messy-scan",
        "location": "page 2, damaged text block",
        "quote": "The affected room is next to the northern loading bay."
      }
    ],
    "reason": "illegible"
  },
  "paid_to_date": {
    "value": {
      "amount": "0",
      "currency": "EUR"
    },
    "confidence": 0.74,
    "evidence": [
      {
        "document_id": "doc-messy-note",
        "location": "line 8",
        "quote": "No payments have been made; paid to date EUR 0."
      }
    ],
    "reason": null
  },
  "outstanding_reserve": {
    "value": null,
    "confidence": 0,
    "evidence": [],
    "reason": "not_found"
  },
  "sender_name": {
    "value": "Sam Sample",
    "confidence": 0.9,
    "evidence": [
      {
        "document_id": "doc-messy-email",
        "location": "signature",
        "quote": "Sam Sample"
      }
    ],
    "reason": null
  },
  "sender_role": {
    "value": null,
    "confidence": 0,
    "evidence": [],
    "reason": "not_found"
  },
  "cedent_notes": {
    "value": null,
    "confidence": 0,
    "evidence": [],
    "reason": "not_applicable"
  }
}
